{
  "authoring_lineage": {
    "derived_from": "configs/presets/mamba_whole_graph_m.yaml",
    "resolution": "one_time_parser_resolution_plus_owner_adjudication",
    "runtime_preset_loader": false,
    "source_sha256": "496c4ec22b497c70bc8409227513939b4cd86834bf2210475d0ad655be6937af"
  },
  "key_count": 454,
  "namespace_schema": "mot17_args_resolved_namespace_v1",
  "resolved_namespace": {
    "acc_alpha": 0.15,
    "adaptive_cap_base": 40,
    "adaptive_cap_max": 60,
    "adaptive_cap_min": 15,
    "adaptive_confirmation": false,
    "adaptive_detection_cap": false,
    "appearance_bank": false,
    "appearance_bank_consistency_threshold": 0.75,
    "appearance_bank_high_quality_min_score": 0.75,
    "appearance_bank_max_aspect": 4.5,
    "appearance_bank_min_aspect": 1.2,
    "appearance_bank_min_iou": 0.35,
    "appearance_bank_min_score": 0.45,
    "appearance_bank_size": 5,
    "appearance_occlusion_cov": 0.4,
    "appearance_occlusion_gate": false,
    "assoc_energy_diagnostics": false,
    "assoc_height_cost_w": 0.0,
    "assoc_score_cost_w": 0.0,
    "association_scoring_mode": "baseline",
    "async_reid": false,
    "bank_quality_v2": true,
    "bank_quality_w_area": 0.1,
    "bank_quality_w_aspect": 0.15,
    "bank_quality_w_center": 0.1,
    "bank_quality_w_det": 0.45,
    "bank_quality_w_iou": 0.2,
    "bank_weighted_mean": false,
    "birth_consecutive_boost": 0.05,
    "birth_consecutive_frames": 2,
    "birth_consecutive_gate": false,
    "birth_consecutive_iou": 0.4,
    "birth_consecutive_min_motion": 0.0,
    "birth_consecutive_min_score": 0.2,
    "birth_low_score_thresh": 0.0,
    "birth_min_quality": 0.0,
    "birth_prox_norm_thresh": 0.0,
    "birth_quality_gate": false,
    "birth_quality_score_bias": 0.15,
    "cheb_gr_engine": "",
    "cheb_gr_fuse_lambda": 0.3,
    "cheb_gr_k2": 6,
    "cheb_gr_lambda": 2.0,
    "cheb_gr_max_fwd": 50,
    "cheb_gr_merge_enabled": false,
    "cheb_gr_merge_max_cost": 0.55,
    "cheb_gr_merge_max_gap": 60,
    "cheb_gr_merge_min_overlap": 1,
    "cheb_gr_merge_n_samples": 50,
    "cheb_gr_model": "siglip2_reid",
    "cheb_gr_online": false,
    "cheb_gr_online_bank_mode": "spread",
    "cheb_gr_online_bank_n": 0,
    "cheb_gr_online_center_dist_veto": 0.0,
    "cheb_gr_online_decide_n": 5,
    "cheb_gr_online_key_margin_min": 0.0,
    "cheb_gr_online_key_sim_cost_floor": 0.0,
    "cheb_gr_online_key_sim_min": 0.0,
    "cheb_gr_online_log": false,
    "cheb_gr_online_margin": 0.0,
    "cheb_gr_online_max_cost": 0.45,
    "cheb_gr_online_min_head": 1,
    "cheb_gr_online_neighbor_iou_max": 0.0,
    "cheb_gr_online_pollution_veto": 0.0,
    "cheb_gr_pool_frac": 0.3,
    "conf_threshold": 0.05,
    "config": null,
    "confirm_score_thresh": 0.5,
    "confirm_streak": 3,
    "consistency_tol": 2.0,
    "contrast": 1.2,
    "cpp_threads": 0,
    "cross_tile_merge": true,
    "cross_tile_score_penalty": 1.0,
    "cross_tile_seam_area_ratio_threshold": 0.3,
    "cross_tile_seam_center_scale": 1.8,
    "cross_tile_seam_min_overlap_ratio": 0.45,
    "crowd_conf_threshold": 0.02,
    "crowd_low_score_mode": false,
    "crowd_low_score_trigger": 25,
    "crowd_mid_thresh": 0.05,
    "crowd_new_track_thresh": 0.25,
    "crowd_track_thresh": 0.02,
    "data_root": "datasets/MOT17",
    "debug_birth_csv": "",
    "debug_dump_csv": "",
    "debug_dump_frames": "",
    "debug_dump_seq": "",
    "detect_barrier": "event",
    "detection_cap_rank_method": "fp_filter_quality",
    "detection_quality_scaling": false,
    "detection_quality_w_area": 0.2,
    "detection_quality_w_aspect": 0.5,
    "detection_quality_w_center": 0.3,
    "detector": null,
    "detector_box_format": "xyxy",
    "double_buffer": true,
    "duplicate_suppression_enabled": false,
    "duplicate_suppression_iou_threshold": 0.85,
    "duplicate_suppression_min_score_ratio": 1.05,
    "enable_motion_only": true,
    "engine": "models/yolo/yolo26m_960_batch1.engine",
    "exp_velocity_aligned_bank": false,
    "external_fp_filter_mode": "rule",
    "external_fp_logistic_model": "",
    "external_fp_logistic_threshold": 0.5,
    "external_fp_max_score": 0.18,
    "external_fp_penalty": 1.0,
    "external_fp_softmax_min_scale": 0.7,
    "force_python_relinker": false,
    "fp_hard_filter_enabled": true,
    "fp_hard_filter_max_suspicious_area": 40000,
    "fp_hard_filter_max_suspicious_score": 0.4,
    "fp_hard_filter_min_score": 0.1,
    "fpn_backbone_engine": "models/yolo/yolo26m_backbone_640_best.engine",
    "fpn_reid_ckpt": "",
    "fuse_score_weight": 0.0,
    "gamma": 0.8,
    "gamma_luma_threshold": 0.35,
    "geometry_ema_beta": 0.8,
    "geometry_loosen_step": 0.08,
    "geometry_max_scale": 1.2,
    "geometry_mid_scale": false,
    "geometry_min_samples": 5,
    "geometry_min_scale": 0.875,
    "geometry_ref_height_ratio": 0.12,
    "geometry_suspect_score": null,
    "geometry_suspect_support": false,
    "geometry_tighten_step": 0.03,
    "gmc": true,
    "gmc_downscale": 4,
    "gmc_fg_mask": false,
    "gmc_mode": "gpu",
    "gmc_pcr_uncertain_thresh": 8.0,
    "gpu_decode": true,
    "high_thresh": 0.45,
    "homography_root": "",
    "id_stability_filter": false,
    "id_stability_max_center_shift": 2.0,
    "id_stability_max_gap": 1,
    "id_stability_min_hits": 2,
    "id_stability_min_iou": 0.05,
    "id_stability_min_score_ema": 0.15,
    "id_stability_score_ema": 0.7,
    "interpolate_max_gap": 35,
    "interpolate_min_h": 0,
    "interpolate_min_track_len": 5,
    "interpolate_tracklets": true,
    "kalman_adapt_mode": 0,
    "kalman_r_scale": 3.5,
    "latency_only": true,
    "lazy_reid_min_hit_streak": 2,
    "lazy_reid_self_threshold": 0.85,
    "lifecycle_ema": 0.83,
    "lifecycle_merge": false,
    "lifecycle_min_gap": 2,
    "lifecycle_min_iou": 0.0,
    "lifecycle_require_embedding": false,
    "lifecycle_sim_threshold": 0.9,
    "lifecycle_spatial_gate": 0.08,
    "lifecycle_ttl": 45,
    "main_nms_graphed": true,
    "mamba_ckpt": "runs/mamba_gt_yolo26m_v14replica_t3_t1/best.ckpt",
    "mamba_head_engine": "models/yolo/mamba_head_26m.engine",
    "mamba_small_p3_max_threshold": 0.0,
    "mamba_teacher_ckpt": "runs/gated_det_yolo26m_v14replica/epoch_0012.ckpt",
    "mamba_yolo_weights": "models/yolo/yolo26m.pt",
    "match_thresh": 0.5,
    "max_det": 300,
    "max_frames": null,
    "mid_thresh": 0.1,
    "min_motion_observations": 2,
    "min_tracklet_len": 1,
    "min_tracklet_score": 0.0,
    "mlflow_experiment": "mot17",
    "mlflow_run_name": null,
    "mlflow_uri": "http://localhost:5000",
    "module_detection": null,
    "module_geometry": null,
    "module_lifecycle": null,
    "module_motion": null,
    "module_reid": null,
    "module_semantic": null,
    "module_trigger": null,
    "motion_consistency_check": true,
    "motion_only_iou_threshold": 0.15,
    "motion_only_lost_frames": 5,
    "motion_only_min_lost_frames": 1,
    "multi_birth_enabled": false,
    "multi_birth_evidence_threshold": 0.6,
    "multi_birth_iou_match": 0.3,
    "multi_birth_max_area_px": 0,
    "multi_birth_min_aspect": 0.0,
    "multi_birth_min_frames": 3,
    "multi_birth_min_score": 0.12,
    "multi_birth_replace_evidence_threshold": 0.85,
    "multi_birth_replace_mode": false,
    "multi_birth_target_motion": 12.0,
    "multi_birth_ttl_frames": 5,
    "multi_birth_w_motion": 0.3,
    "multi_birth_w_quality": 0.2,
    "multi_birth_w_score": 0.35,
    "multi_birth_w_streak": 0.15,
    "multiplicative_cost": true,
    "narrow_person_max_aspect": 4.8,
    "narrow_person_max_width_ratio": 0.018,
    "narrow_person_min_aspect": 2.0,
    "narrow_person_min_height_ratio": 0.045,
    "narrow_person_score_bonus": 0.0,
    "need_reid": false,
    "new_track_thresh": 0.28,
    "nms_iou_threshold": null,
    "no_gpu_decode": false,
    "no_temporal": false,
    "no_visualize_score": false,
    "nsa_kalman": false,
    "oao_contest_thresh": -1.0,
    "oao_crowd_radius": 0.0,
    "oao_foot_gate": 0.0,
    "oao_height_gate": 0.0,
    "oao_occ_mode": 0,
    "oao_ramp_frames": 25,
    "oao_score_w": -1.0,
    "oao_tau": 0.5,
    "occ_audit": false,
    "occ_audit_chebgr_fuse_lambda": 0.3,
    "occ_audit_chebgr_k2": 6,
    "occ_audit_chebgr_lambda": 2.0,
    "occ_audit_chebgr_margin": 0.0,
    "occ_audit_chebgr_max_cost": 0.45,
    "occ_audit_chebgr_max_fwd": 50,
    "occ_audit_chebgr_pool_frac": 0.3,
    "occ_audit_chebgr_probe": false,
    "occ_audit_crops": 3,
    "occ_audit_log": false,
    "occ_audit_min_occ": 2,
    "occ_audit_min_ref": 2,
    "occ_audit_ref_n": 5,
    "occ_audit_tau": 0.45,
    "occ_audit_window": 30,
    "occ_cost_weight": 0.5,
    "occ_foot_gap": 0.15,
    "occ_iou_thresh": 0.45,
    "occ_state_enabled": true,
    "occ_ttl": 4,
    "output": "${H2_RUN_DIR}/_runtime",
    "per_frame_detection_cap": 0,
    "per_seq_adapt": false,
    "person_class": 0,
    "person_geometry_prior": false,
    "person_max_area_ratio": 0.0,
    "person_max_aspect": 5.5,
    "person_min_area_ratio": 6e-05,
    "person_min_aspect": 1.0,
    "person_min_height_ratio": 0.018,
    "pipeline_relink": false,
    "pose_engine": null,
    "post_lifecycle_appearance_gate": false,
    "post_lifecycle_appearance_max_samples": 5,
    "post_lifecycle_appearance_min_consistency": 0.0,
    "post_lifecycle_appearance_min_samples": 1,
    "post_lifecycle_appearance_min_score": 0.0,
    "post_lifecycle_appearance_threshold": 0.9,
    "post_lifecycle_appearance_weight": 0.0,
    "post_lifecycle_consistency_weight": 0.0,
    "post_lifecycle_direction_weight": 0.25,
    "post_lifecycle_gap_uncertainty_weight": 0.0,
    "post_lifecycle_max_cost": 1.25,
    "post_lifecycle_merge": false,
    "post_lifecycle_min_gap": 1,
    "post_lifecycle_missing_appearance_cost": 0.5,
    "post_lifecycle_motion_weight": 0.45,
    "post_lifecycle_spatial_weight": 0.35,
    "post_lifecycle_time_weight": 0.1,
    "post_lifecycle_ttl": 60,
    "post_lifecycle_velocity_samples": 5,
    "preprocess": "none",
    "preset": null,